{
    "created_at_utc": "2026-02-09T16:00:02Z",
    "evidence_artifacts": {
        "metrics": {
            "schema_valid": 1.0,
            "signals_present": 1.0
        },
        "run_id": "N/A",
        "summary": "Validation run in mode schema_only. Internal Status: PASS"
    },
    "governance_id": "938bfd54-edd3-4e06-bac6-bc4e32fc7828",
    "proposal_id": "d68e5a92-3a47-4cbb-858e-c288936303af",
    "schema_version": "1.0.0",
    "validation_outcome": "PASS",
    "validator_context": {
        "environment": "ci",
        "runner_id": "admin_user"
    }
}