{
    "created_at_utc": "2026-02-09T17:24:09Z",
    "evidence_artifacts": {
        "metrics": {
            "schema_valid": 1.0,
            "signals_present": 1.0
        },
        "run_id": "N/A",
        "summary": "Validation run in mode schema_only. Internal Status: PASS"
    },
    "governance_id": "5ae37352-2695-410b-aaeb-b9d61ef79e11",
    "proposal_id": "ad6b9b45-3b15-4dbb-8528-ca6408e57ad0",
    "schema_version": "1.0.0",
    "validation_outcome": "PASS",
    "validator_context": {
        "environment": "ci",
        "runner_id": "admin_user"
    }
}